<!ELEMENT lessons (lesson+)>
<!ELEMENT lesson (LessonName, ProfSurname, Time, StartDate, EndDate)>
<!ELEMENT LessonName (#PCDATA)>
<!ELEMENT ProfSurname (#PCDATA)>
<!ELEMENT Time (#PCDATA)>
<!ELEMENT StartDate (#PCDATA)>
<!ELEMENT EndDate (#PCDATA)>